file,text,file_name,line_name,id
1_00,d d d s n r d u r d d d a d p o j d d p f d s d l c d a a o d d a u d c n m e l d t d d l a a t g v n r a c 1 d c p d l b p d c n p d d t d j t c o r d j d d g a p s m d m t,1,0,1_0
1_01,d r p o a g,1,1,1_1
1_02,d c b v f l,1,2,1_2
1_03,h 3 b b t d o g y w o 2 f j h r 1 s o n,1,3,1_3
1_04,g d j g b t t e f a g i,1,4,1_4
1_05,a o e l,1,5,1_5
1_06,j l o t e c,1,6,1_6
1_07,o s t l p v,1,7,1_7
1_08,o l b c n 9 d,1,8,1_8
1_09,e g d 9 j n e s 1 n s j f 1 y g f f t i i,1,9,1_9
1_10,h m e b p o c p o 9 c g t 9,1,10,1_10
1_11,h b s d r r l b f p b l t o z e n i,1,11,1_11
1_12,a s i o t l h,1,12,1_12
1_13,l g g q r h l t m g t d 1 r a w s m y p l d d d s q l p a d e c i,1,13,1_13
2_00,d d d d d d s n o a r d d p c d n p f d d d d e c e s o r d d d e a o d b d e t t d d l l r t o v o o d d r d c g p d c a d d m r l r c r t b d o l d n d a p c d g r,2,0,2_0
2_01,,2,1,2_1
2_02,s h b t s d a h l y i i i s s f d b l i s g a,2,2,2_2
2_03,s h j o e s n g p t f c t 1 q a,2,3,2_3
2_04,l v h e d p t c d h c o i r p l i,2,4,2_4
2_05,b l b n p,2,5,2_5
2_06,e 4 t s c j j c l j b d f s t a 1 t t,2,6,2_6
2_07,l m g j e c t e d l u t c l,2,7,2_7
2_08,c l d e b o d p 3 j f e o s f t p 1,2,8,2_8
2_09,p b c n l d,2,9,2_9
2_10,o i n t,2,10,2_10
2_11,s 1 e f b c g s y j e l z a n c z e,2,11,2_11
2_12,k a s g n a 1 o l s s s j t l i c r,2,12,2_12
2_13,a l o l f,2,13,2_13
2_14,a o l g j l m d t c g g l g 1 z r i o s p 1 n d r l d l y i p a t c c s s n n l 9 c,2,14,2_14
3_00,d d d a s n d d d r o p p c d d n d j d d m d d l c d s o d d d n l l c j m l d t o d l d q n v n g i r d c l d c d a p d t n j t s r c t r n l s l d d d p t o p d c,3,0,3_0
3_01,y e l g p j d i h 2 w z p t n s 2 k,3,1,3_1
3_02,c f d b f h s d a c e p a f f d r d l e f,3,2,3_2
3_03,r 1 d o h g t o l b i e m i,3,3,3_3
3_04,b l h n d,3,4,3_4
3_05,o l n z o f l,3,5,3_5
3_06,y y g c e l w d i o 1 m t t t i l,3,6,3_6
3_07,o h 3 a m e e j s l h z t o i m t s 1 o p j g s d t,3,7,3_7
3_08,5 o o b g s s t s o c n j a l 6 t,3,8,3_8
3_09,a q c n l d,3,9,3_9
3_10,a y g m e n b l r s x c z g z l,3,10,3_10
3_11,b l d s s l e i e s t s,3,11,3_11
3_12,c l e h l l g l m e i,3,12,3_12
3_13,g l o n 7 d l d r e s p l d d l d f l p a d n c c l c a s s n l,3,13,3_13
4_00,d d d d s d n d a r o d p p c d d n f d d c h d d d v o d m d d a d o s m e l d c d d x e b r v t d d r d c l d e l p d j c s h n l e l l p c t c c s d c d a p s m t d i,4,0,4_0
4_01,a p n c d,4,1,4_1
4_02,c h b q c t o d i l l h f s r i t,4,2,4_2
4_03,v h w t t p 5 s u d o g l e s f u t s,4,3,4_3
4_04,a l w l e m,4,4,4_4
4_05,o l n g t,4,5,4_5
4_06,b l o l s g q l s m a l f a c z s l i j 1 l,4,6,4_6
4_07,s l j e y v e t l c,4,7,4_7
4_08,b h n c p l,4,8,4_8
4_09,r n o l c,4,9,4_9
4_10,a l d d n i c,4,10,4_10
4_11,j r a h c c g n a r d m t 1 c 1 l,4,11,4_11
4_12,k s f t g k z 2 3 o d h i s s t j 4,4,12,4_12
4_13,b h h c n i o l d o r o s p l n d l d l l p a d c c s l c b s s n m,4,13,4_13
5_00,d l d d d s n r d a d o c p m p d d h d l f d d d d s o j d b d a a c u m e l d l d d t v l d t w c d d p d c c l j c c c d p e d n r t t i i s p c s d a p d l e n c i,5,0,5_0
5_01,i,5,1,5_1
5_02,s b s k a x c y s r s s y s 1 l t k,5,2,5_2
5_03,l o j h c e b u e x e v x o i,5,3,5_3
5_04,p h n r j s w p o t l r,5,4,5_4
5_05,d 9 h b g h k j l e 2 u m r a,5,5,5_5
5_06,o l l b b a d 2 n f 2 h d i 2 i s,5,6,5_6
5_07,b s n l l,5,7,5_7
5_08,j u f m s 7 d u t j 2 t s c 1 g e i c,5,8,5_8
5_09,9 o d e d p z c z k a l a s j t l g l,5,9,5_9
5_10,b e n v d,5,10,5_10
5_11,h j i p z f s y z a c l l,5,11,5_11
5_12,j h j p d l s l b 1 s e 9 r i l,5,12,5_12
5_13,l j p b s s l i s s l c l 1,5,13,5_13
5_14,s r r h t l d i h a c d 1 d f e a l s l p s a d a d g s p m c c s i c l,5,14,5_14
6_00,d d d d d a d s d d p o n n p r d c d d d a o d k d o j d b d a s c d u e d u l l t d u v u d d p d s p d c d n l r j u t c t o m c c e l a r r d c d c d n d o l,6,0,6_0
6_01,l,6,1,6_1
6_02,s 1 l o v n q i i o f s t t t 7 f i,6,2,6_2
6_03,s v d 1 e a a s s t y c 1 i,6,3,6_3
6_04,v j g p t 5 j e c c a,6,4,6_4
6_05,o 1 j a l s e j l c s l n m t,6,5,6_5
6_06,l e n j l d,6,6,6_6
6_07,c e 1 h g h d l n j o l g f,6,7,6_7
6_08,s s u d s 7,6,8,6_8
6_09,b b o e d 1,6,9,6_9
6_10,j s 9 r n a j p z e j r g i,6,10,6_10
6_11,1 h i e j n j h l e l p d l c c,6,11,6_11
6_12,s i a z j d j j c j w e t h,6,12,6_12
6_13,a b w d 1,6,13,6_13
6_14,e 1 h b 3 i d s i e h o d f l 1 i,6,14,6_14
7_00,s d d n d d d d r c d a c o d o l d d p n p d s n d d d d o l d c l i d m e l d i o d v d d d a e c d m c l p r g d d d r d p c d d l l u c n p a d s d d t c n l c e i,7,0,7_0
7_01,l a d g t,7,1,7_1
7_02,a c 1 g i o l o j c a t w f s j t t 8 c 1,7,2,7_2
7_03,c l e s d i,7,3,7_3
7_04,m p b y j h 1 h h b e t l a z c,7,4,7_4
7_05,u l h d s f i,7,5,7_5
7_06,o b h n d i,7,6,7_6
7_07,j h e u 7,7,7,7_7
7_08,s m e f t c r j f v 1 l 1 c m f s,7,8,7_8
7_09,j a w j 1 d,7,9,7_9
7_10,s e v 1 i,7,10,7_10
7_11,h w l f 1,7,11,7_11
7_12,o 1 e a l q 1 g i q s s r 1 t o l a t j c,7,12,7_12
7_13,h 4 h c w f c h s j h i s j t m c e,7,13,7_13
8_00,d d d d d s n a r d d c o p m p d h d d c m d d t d d a o j d d d m c m n e l d l d e v t t d d p d d t o c l d c p r m c d l l d d c o d n m r o m b g a e,8,0,8_0
8_01,a n f u,8,1,8_1
8_02,b j l a y d a i s i d y y s s z g g n l t f i,8,2,8_2
8_03,j 1 f j j f j 1 l l b t a l s 9 j t f,8,3,8_3
8_04,r n j j f s e d o s l k y s,8,4,8_4
8_05,s h l e b s t i k z o c t s a,8,5,8_5
8_06,j 4 a d 1 q g f r,8,6,8_6
8_07,h 4 l z 1 m b s l i e o m l e a,8,7,8_7
8_08,t 4 b n q y r i c k e o l p t s t t,8,8,8_8
8_09,1 y c e g f l l y t d o i l e f m i i,8,9,8_9
8_10,k o j c e d b m i g o h l p s l 1,8,10,8_10
8_11,b d j p l e d s l g t a m g f l d g j,8,11,8_11
8_12,s l v b n i d,8,12,8_12
8_13,b b u t o t n l d d s s p n d d t j p,8,13,8_13
9_00,s n d d r d d d i e d t l p o d d d p c n l i u d d d d o d a o u s u d u m k l d t l e d v d a i e o a c o j u c d d r d r p d c l u d m c d n d d p d s c g d p l d c,9,0,9_0
9_01,s d m n e,9,1,9_1
9_02,g 4 j y c l s s t a v c w s c s s g t,9,2,9_2
9_03,s w n d u l,9,3,9_3
9_04,o n w d l,9,4,9_4
9_05,o l m n d,9,5,9_5
9_06,s j p d,9,6,9_6
9_07,b b m n d,9,7,9_7
9_08,h t o b n t,9,8,9_8
9_09,s 9 l j d f f s t g s 3 c i e i,9,9,9_9
9_10,l s d c a e z,9,10,9_10
9_11,d l t c 1 e,9,11,9_11
9_12,c 9 d c p j z p b a s 8 j,9,12,9_12
9_13,b g d d b i t d o o p b d a g,9,13,9_13
10_00,d s n d d d r d d c a n d p d p d d d n c i b t d d d o a d d b o s d g u u e l d t i l v s l c d c c l m d l d d p c r d e l a d a e l g s d a r u a d o e a r,10,0,10_0
10_01,d p v d a,10,1,10_1
10_02,i l q h n e d d a t s a s 1 y o 1,10,2,10_2
10_03,b l q d f,10,3,10_3
10_04,o l z e c h t w d h l j o j f g a a e,10,4,10_4
10_05,b c d l,10,5,10_5
10_06,j l o f b o o e i s s e i e 1 c,10,6,10_6
10_07,l v e r s u i c l,10,7,10_7
10_08,l l c d i,10,8,10_8
10_09,b e d o t,10,9,10_9
10_10,l h l d e y n d y d g 1 1,10,10,10_10
10_11,j l h c i d,10,11,10_11
10_12,l l x d n b n e n s l a w g,10,12,10_12
10_13,l g s h f e d r a 7 s r p n l n d a d q l p a l c c i s n,10,13,10_13
11_00,d d s n r d d c d d n d d a p o p c d d n m d s d o d d l d d m c j d a m e l d t l d l v l c l a c d c j c g r i t p d b d r c l t i d c p n n d a p d l a s g a t,11,0,11_0
11_01,o c f,11,1,11_1
11_02,b l c b c d,11,2,11_2
11_03,o m h g s z w g q q e,11,3,11_3
11_04,o l c d,11,4,11_4
11_05,l d d z v h q l j l,11,5,11_5
11_06,g c c c l,11,6,11_6
11_07,b p d d,11,7,11_7
11_08,b s c y o d l,11,8,11_8
11_09,j h a q l,11,9,11_9
11_10,h s d d l,11,10,11_10
11_11,5 b 4 c p l q e o l l e t a c,11,11,11_11
11_12,n d x d d f i,11,12,11_12
11_13,a a h c c d i l d r s p j n 1 i c,11,13,11_13
12_00,d d s n d d r o d r u d o e d p p d d n e d d d o l d a u l m e l d v p m d r d r n p n d n d a p d c o m h d d i,12,0,12_0
12_01,o n a d s r t r w c w a a e,12,1,12_1
12_02,c g a d n j f l 1,12,2,12_2
12_03,k l d n h d i,12,3,12_3
12_04,r a c w r,12,4,12_4
12_05,a o c z e,12,5,12_5
12_06,g l c e z p r s i s f e x o z f z t c,12,6,12_6
12_07,s s c j g j e l n l j i h t o c f i z r,12,7,12_7
12_08,l h t l t a e c j 1 1 e l f c q,12,8,12_8
12_09,h w f o t b m f s 1 i t l l,12,9,12_9
12_10,g p w c d p d,12,10,12_10
12_11,a b w d r l,12,11,12_11
12_12,h c w v p b z g 1 o 2 s o s z l,12,12,12_12
12_13,4 o d a r g l e e f i i d a o p t r s p s n i l d d t l p a u c,12,13,12_13
13_00,s n d d r d d d d c s d a d p d d p d m h m u d d d o d d a c d l t m l d l l a d d a g v c d c c d m d g d d r c r e t d p c p d d l n d d a p a l m d r,13,0,13_0
13_01,c d l 1 h u,13,1,13_1
13_02,y p b c w d,13,2,13_2
13_03,o f s e l q l f a c,13,3,13_3
13_04,h z u c d,13,4,13_4
13_05,w a u l h b c s a b t k d 9 a t a,13,5,13_5
13_06,j l m l j j y 1 7 f c s l s g,13,6,13_6
13_07,b e i c f,13,7,13_7
13_08,o w d o l,13,8,13_8
13_09,v h x u g g b s r l o t j l n s j,13,9,13_9
13_10,b h 1 c j a g s l e n d f g 4 g i c e s j h h a n m n,13,10,13_10
13_11,n b l r d s a d s c s i 9 8 h s s,13,11,13_11
13_12,t j p l 8 r i s 1 i f i l o s 1 v e s a a s s g a c f c a g h,13,12,13_12
13_13,b b i d h l e r s p j n d l e,13,13,13_13
14_00,r n d d s c d d m o d d p l a n d o l o p d e d d d d u c d l d d j d s e l d t a s g v c c c c l i i p d d p r t b u c r l g d d d p o c a s i n m j d d n r,14,0,14_0
14_01,c d b t a,14,1,14_1
14_02,s a c d 3 f f f c l p j a c q c i,14,2,14_2
14_03,s o h d s s t u c f p t d a s t,14,3,14_3
14_04,l b j f,14,4,14_4
14_05,b b t f j,14,5,14_5
14_06,o j l f,14,6,14_6
14_07,j c l 3 i e j 1 u f c t t c c g j b r l r l y l 1,14,7,14_7
14_08,s 3 s s j h f f d c 1,14,8,14_8
14_09,5 w 3 e 1 j y n r t i t 4 t s 1,14,9,14_9
14_10,o e j d,14,10,14_10
14_11,s h f v c f g h f 1 e h j s t r s e z,14,11,14_11
14_12,b l j f,14,12,14_12
14_13,j b f l d r e s p l n d i d g s q p l c a d,14,13,14_13
15_00,d d d a d o n p n p d s r d d d d d c h d d d d s l c d d m i o d d d i o u u l m e l d l r d s l u d p n v d o p c d d t a c s t l g d r c r o d u a p o e l d j c,15,0,15_0
15_01,l b q e d n h j g a 3 h h a t c d i t,15,1,15_1
15_02,s o 4 d s,15,2,15_2
15_03,d b n s,15,3,15_3
15_04,b l c s e,15,4,15_4
15_05,v o e,15,5,15_5
15_06,o 5 s t h o e a e d s i z h t f m h e l e i,15,6,15_6
15_07,o d j f,15,7,15_7
15_08,s t l d f j j j n z t a u a g,15,8,15_8
15_09,b t f t,15,9,15_9
15_10,b s f d,15,10,15_10
15_11,j q g c,15,11,15_11
15_12,g s j d,15,12,15_12
15_13,f c u h e l f l d t m a m r s s r a k p l a n d j d y s p,15,13,15_13
16_00,d d d d a n o d d s r d d p p n c d s d d d d i c d u o u d e o a c m m d l l l d l c e i d d v d p d a e p d 1 d t e s c e o e l t q c c m e d d a p l i n d g c,16,0,16_0
16_01,q s c j l l j a h d t h j f s d t 2 i l,16,1,16_1
16_02,g y b t q z r o d d t e s i,16,2,16_2
16_03,a j c a g j s s f s i s,16,3,16_3
16_04,a c d d,16,4,16_4
16_05,b h s o u,16,5,16_5
16_06,g l s n d,16,6,16_6
16_07,o v e,16,7,16_7
16_08,b s g v l l q r c r m s a,16,8,16_8
16_09,a u u s d,16,9,16_9
16_10,o m c e,16,10,16_10
16_11,b w t d,16,11,16_11
16_12,o 1 m h n b s j a f s m g a c r l l u a f,16,12,16_12
16_13,b e m j j l d o r s p l n d l d l l p a u s c s i i c s,16,13,16_13
17_00,d m d d o a p d d s u r d d p n o d h d d d d m c d a o d l d d l a d c i e m e l d t d d o t p l d g v u d p d c p d e d g c n s l t c i t c c p c r d d a d d t s d d t n t 3,17,0,17_0
17_01,o t d d m s,17,1,17_1
17_02,j o l d b b l t w k f,17,2,17_2
17_03,y j l g e g n o t t 7 l,17,3,17_3
17_04,g d w j e,17,4,17_4
17_05,l 1 t r f o f 7 f s s e l i b,17,5,17_5
17_06,b d w s c,17,6,17_6
17_07,s j o h n f d f f v c e z 5 i,17,7,17_7
17_08,o a s a o l i,17,8,17_8
17_09,o d o t n d f i v f i t c c 1 e g,17,9,17_9
17_10,b m f j,17,10,17_10
17_11,j m n t,17,11,17_11
17_12,r l b g n m m r i t a,17,12,17_12
17_13,i o u l b d t b i s q e r e e s p d d a d y s p o d,17,13,17_13
18_00,d d i d a o d p d s n d n p d r d c d d u d d h l l d a d o d d u d c l a m d e l l t e l d i t g d d p v d p d l a c h t d t o i t t l l d f g r d a a p l e l r e,18,0,18_0
18_01,b p e t j 1,18,1,18_1
18_02,s p t t,18,2,18_2
18_03,y p f s d,18,3,18_3
18_04,c 1 c e r s p h q s c c b s s j s s p 5,18,4,18_4
18_05,b c j d,18,5,18_5
18_06,b h j d,18,6,18_6
18_07,s 1 g c a e b e h f l x y e n c l a f l,18,7,18_7
18_08,s a w q c p s g g b s e h g g t l q 7 a,18,8,18_8
18_09,b l c d,18,9,18_9
18_10,h 1 e l c p p a a c l j c e s f p l a 1,18,10,18_10
18_11,1 o d l u q u t e c e f c,18,11,18_11
18_12,v 1 r g c o 3 b j m s s s a l,18,12,18_12
18_13,d 1 j h a r l e j r a a s p 1 l b d d d q o p a l c,18,13,18_13
19_00,d d d d s n d a d d p o p r d n d c k d d d d l c s d n o j d d d e b c n m e l d t d d s l r v l d d d p m l p d d o t c o c d r c r t l h p t d a p d l i n d t e,19,0,19_0
19_01,o l s d e 7,19,1,19_1
19_02,b h d,19,2,19_2
19_03,b c,19,3,19_3
19_04,g r s j g d,19,4,19_4
19_05,o p n d,19,5,19_5
19_06,s 9 c s n d y f s c 5 a o 2 o z i 1 t i s s i f,19,6,19_6
19_07,t a k g g t z e t e y o g t t e 1,19,7,19_7
19_08,s s d c f i l l d e t,19,8,19_8
19_09,o d j d,19,9,19_9
19_10,a s o d,19,10,19_10
19_11,s v d f b f e f 1 i b g p l u z a t e j,19,11,19_11
19_12,s l c e d,19,12,19_12
19_13,h 1 b j v a e x c f s y r c c c s t t d p l l n f d d u c p o l,19,13,19_13
20_00,d d d s d a d d n o r p n p d d d c d n d d d d c l d t m o n l d m c n m e l d d l p d d d v l s g d d d s d d p o d c e c d h e j m o t t t o d p d a s e l d c,20,0,20_0
20_01,s b s d r,20,1,20_1
20_02,b p p d,20,2,20_2
20_03,e d o m d,20,3,20_3
20_04,b c d l d,20,4,20_4
20_05,4 o d c r j a e v m a g a,20,5,20_5
20_06,g o j d j g e c t i,20,6,20_6
20_07,a c c c j d,20,7,20_7
20_08,s l c h s o,20,8,20_8
20_09,s 1 w d l n c o h o c m l o 1 1,20,9,20_9
20_10,o r s s g s s d j j j t i,20,10,20_10
20_11,g a o n d,20,11,20_11
20_12,b m i d,20,12,20_12
20_13,5 r g v u s e o n f r t l d r o s j s p n l a d g l t p a,20,13,20_13
